{
  "inherit": [
    "base.test_list"
  ],
  "constants": {},
  "options": {},
  "definitions": {
    "CheckFPFirmware": {
      "pytest_name": "update_fpmcu_firmware",
      "label": "Check Fingerprint Firmware",
      "run_if": "device.component.has_fingerprint",
      "args": {
        "method": "CHECK_VERSION"
      }
    },
    "ElanFPSTest": {
      "pytest_name": "fingerprint_sensor_elan",
      "label": "Elan Fingerprint Sensor Test",
      "run_if": "device.component.has_fingerprint and device.component.fingerprint_board == 'buccaneer'",
      "args": {
        "fpmode_retry_count": 2
      }
    },
    "FPSGroup": {
      "label": "Fingerprint Test Group",
      "run_if": "device.component.has_fingerprint",
      "subtests": [
        "UpdateFPFirmware",
        "RebootStep",
        "CheckFPFirmware",
        "ElanFPSTest",
        "FPSTest"
      ]
    },
    "FPSTest": {
      "pytest_name": "fingerprint_sensor_fpc",
      "label": "Fingerprint Sensor test",
      "run_if": "device.component.has_fingerprint",
      "args": {
        "fpframe_retry_count": 2
      }
    },
    "UpdateFPFirmware": {
      "pytest_name": "update_fpmcu_firmware",
      "label": "Update Fingerprint Firmware",
      "run_if": "device.component.has_fingerprint"
    }
  }
}
