{
  "inherit": [
    "generic_audio_examples.test_list",
    "generic_battery_examples.test_list",
    "generic_camera_examples.test_list",
    "generic_cellular_examples.test_list",
    "generic_display_panel_examples.test_list",
    "generic_dram_examples.test_list",
    "generic_ec_component_accel_examples.test_list",
    "generic_ec_component_als_examples.test_list",
    "generic_ethernet_examples.test_list",
    "generic_fingerprint_examples.test_list",
    "generic_storage_examples.test_list",
    "generic_touchpad_examples.test_list",
    "generic_touchscreen_examples.test_list",
    "generic_tpm_examples.test_list",
    "generic_wireless_examples.test_list",
    "generic_common.test_list"
  ],
  "label": "Main Readiness Factory tests",
  "constants": {},
  "options": {
    "auto_run_on_start": false
  },
  "definitions": {
    "MiscellaneousHWTests": {
      "inherit": "TestGroup",
      "subtests": [
        "Keyboard",
        "HWButton",
        "Fan",
        "ThermalSensors"
      ]
    }
  },
  "tests": [
    "AccelerometerIMUTests",
    "AmbientLightSensorTests",
    "AudioTests",
    "BatteryTests",
    "CameraTests",
    "CellularTests",
    "DRAMTests",
    "DisplayPanelTests",
    "EthernetTests",
    "FingerprintTests",
    "FPCFPSTests",
    "StorageTests",
    "TouchscreenTests",
    "TouchpadTests",
    "TPMTests",
    "WirelessTests",
    "MiscellaneousHWTests"
  ]
}
